{
  "$schema": "../release-fragment.schema.json",
  "id": "real-world-document-fidelity-corpus",
  "impact": "none",
  "components": [
    "infrastructure",
    "importer",
    "spreadsheet"
  ],
  "category": "improved",
  "summary": "PVAD now continuously measures structural, semantic, and visual fidelity against a licensed real-world PDF, DOCX, and XLSX corpus without overstating failed reviews.",
  "featureIds": [],
  "documentation": [
    "/checklists/PVAD.Proven-Document-Fidelity.md"
  ],
  "breaking": false,
  "reason": "Internal quality evidence and CI coverage do not change customer-facing behavior."
}
