{
  "id": "pvad-public-documentation-naming",
  "impact": "patch",
  "components": ["documentation"],
  "category": "improved",
  "summary": "Use PVADE branding on PDF Trust download guides and update documentation examples to proposed PVADE hostnames while preserving historical evidence and distinguishing retained runtime defaults.",
  "breaking": false
}
