{
  "$schema": "../release-fragment.schema.json",
  "id": "release-author-skill-evals",
  "impact": "none",
  "components": [
    "infrastructure"
  ],
  "category": "improved",
  "summary": "Release-author guidance now has representative validation scenarios for consistent change classification.",
  "breaking": false,
  "reason": "This change adds internal skill evaluation coverage without changing shipped product behavior."
}
