{
  "$schema": "../release-fragment.schema.json",
  "id": "legal-document-governance",
  "impact": "minor",
  "components": [
    "account",
    "admin",
    "api",
    "company",
    "demo",
    "designer",
    "documentation",
    "infrastructure",
    "spreadsheet"
  ],
  "category": "added",
  "summary": "Legal governance now includes approval, resilient snapshots and recovery, Account review gates, audited evidence exports, enforced technical inventories, production retention gates, safe dry runs, and auditable Legal Holds.",
  "featureIds": [],
  "breaking": false
}
