{
  "$schema": "../release-fragment.schema.json",
  "id": "designer-code-export-parity",
  "impact": "patch",
  "components": [
    "designer",
    "documentation"
  ],
  "category": "fixed",
  "summary": "Designer code export now preserves the complete canonical JSON document and generates C# from the same source through the backend converter.",
  "featureIds": [
    "designer.code-workspace"
  ],
  "documentation": [
    "/docs/code-designer-workspace.md"
  ],
  "breaking": false
}
